tests/testthat/fixtures/ppm-status.json

{"version":"2025.12.0-12","build_date":"2025-12-22T18:11:59Z","metrics_enabled":false,"r_configured":true,"python_configured":true,"binaries_enabled":true,"display_ash":false,"custom_home":false,"custom_home_title":"Posit Public Package Manager","ga_id":"GTM-KHBDBW7","auth_available":false,"sso_enabled":false,"distros":[{"name":"centos7","os":"linux","binaryDisplay":"CentOS/RHEL 7","binaryURL":"centos7","display":"CentOS 7","distribution":"centos","release":"7","build_distribution":"","sysReqs":true,"binaries":true,"hidden":false,"official_rspm":true,"arch":["x86_64"]},{"name":"centos8","os":"linux","binaryDisplay":"CentOS/RHEL 8","binaryURL":"centos8","display":"CentOS 8","distribution":"centos","release":"8","build_distribution":"","sysReqs":true,"binaries":true,"hidden":true,"official_rspm":true,"arch":["x86_64"]},{"name":"rhel9","os":"linux","binaryDisplay":"Rocky Linux 9","binaryURL":"rhel9","display":"Rocky Linux 9","distribution":"rockylinux","release":"9","build_distribution":"","sysReqs":true,"binaries":true,"hidden":false,"official_rspm":true,"arch":["x86_64","arm64"]},{"name":"rhel10","os":"linux","binaryDisplay":"Rocky Linux 10","binaryURL":"rhel10","display":"Rocky Linux 10","distribution":"rockylinux","release":"10","build_distribution":"","sysReqs":true,"binaries":true,"hidden":false,"official_rspm":true,"arch":["x86_64","arm64"]},{"name":"opensuse15","os":"linux","binaryDisplay":"OpenSUSE 15.1, SLES 15 SP1","binaryURL":"opensuse15","display":"OpenSUSE 15.1","distribution":"opensuse","release":"15","build_distribution":"","sysReqs":true,"binaries":true,"hidden":true,"official_rspm":true,"arch":["x86_64"]},{"name":"opensuse152","os":"linux","binaryDisplay":"OpenSUSE 15.2, SLES 15 SP2","binaryURL":"opensuse152","display":"OpenSUSE 15.2","distribution":"opensuse","release":"15.2","build_distribution":"","sysReqs":true,"binaries":true,"hidden":true,"official_rspm":true,"arch":["x86_64"]},{"name":"opensuse153","os":"linux","binaryDisplay":"OpenSUSE 15.3, SLES 15 SP3","binaryURL":"opensuse153","display":"OpenSUSE 15.3","distribution":"opensuse","release":"15.3","build_distribution":"","sysReqs":true,"binaries":true,"hidden":true,"official_rspm":true,"arch":["x86_64"]},{"name":"opensuse154","os":"linux","binaryDisplay":"OpenSUSE 15.4, SLES 15 SP4","binaryURL":"opensuse154","display":"OpenSUSE 15.4","distribution":"opensuse","release":"15.4","build_distribution":"","sysReqs":true,"binaries":true,"hidden":true,"official_rspm":true,"arch":["x86_64"]},{"name":"opensuse155","os":"linux","binaryDisplay":"OpenSUSE 15.5, SLES 15 SP5","binaryURL":"opensuse155","display":"OpenSUSE 15.5","distribution":"opensuse","release":"15.5","build_distribution":"","sysReqs":true,"binaries":true,"hidden":true,"official_rspm":true,"arch":["x86_64"]},{"name":"opensuse156","os":"linux","binaryDisplay":"OpenSUSE 15.6, SLES 15 SP6/SP7","binaryURL":"opensuse156","display":"OpenSUSE 15.6","distribution":"opensuse","release":"15.6","build_distribution":"","sysReqs":true,"binaries":true,"hidden":false,"official_rspm":true,"arch":["x86_64"]},{"name":"opensuse42","os":"linux","binaryDisplay":"OpenSUSE 42.3, SLES 12 SP5","binaryURL":"opensuse42","display":"OpenSUSE 42.3","distribution":"opensuse","release":"42.3","build_distribution":"","sysReqs":true,"binaries":true,"hidden":true,"official_rspm":true,"arch":["x86_64"]},{"name":"rhel7","os":"linux","binaryDisplay":"CentOS/RHEL 7","binaryURL":"centos7","display":"Red Hat Enterprise Linux 7","distribution":"redhat","release":"7","build_distribution":"","sysReqs":true,"binaries":true,"hidden":false,"official_rspm":true,"arch":["x86_64"]},{"name":"rhel8","os":"linux","binaryDisplay":"RHEL 8","binaryURL":"centos8","display":"Red Hat Enterprise Linux 8","distribution":"redhat","release":"8","build_distribution":"","sysReqs":true,"binaries":true,"hidden":false,"official_rspm":true,"arch":["x86_64"]},{"name":"rhel9 (unused alias)","os":"linux","binaryDisplay":"RHEL 9","binaryURL":"rhel9","display":"Red Hat Enterprise Linux 9","distribution":"redhat","release":"9","build_distribution":"","sysReqs":true,"binaries":true,"hidden":false,"official_rspm":true,"arch":["x86_64","arm64"]},{"name":"rhel10 (unused alias)","os":"linux","binaryDisplay":"RHEL 10","binaryURL":"rhel10","display":"Red Hat Enterprise Linux 10","distribution":"redhat","release":"10","build_distribution":"","sysReqs":true,"binaries":true,"hidden":false,"official_rspm":true,"arch":["x86_64","arm64"]},{"name":"sles12","os":"linux","binaryDisplay":"OpenSUSE 42.3, SLES 12 SP5","binaryURL":"opensuse42","display":"SLES 12 SP5","distribution":"sle","release":"12.3","build_distribution":"","sysReqs":true,"binaries":true,"hidden":true,"official_rspm":true,"arch":["x86_64"]},{"name":"sles15","os":"linux","binaryDisplay":"OpenSUSE 15.1, SLES 15 SP1","binaryURL":"opensuse15","display":"SLES 15 SP1","distribution":"sle","release":"15","build_distribution":"","sysReqs":true,"binaries":true,"hidden":true,"official_rspm":true,"arch":["x86_64"]},{"name":"sles152","os":"linux","binaryDisplay":"OpenSUSE 15.2, SLES 15 SP2","binaryURL":"opensuse152","display":"SLES 15 SP2","distribution":"sle","release":"15.2","build_distribution":"","sysReqs":true,"binaries":true,"hidden":true,"official_rspm":true,"arch":["x86_64"]},{"name":"sles153","os":"linux","binaryDisplay":"OpenSUSE 15.3, SLES 15 SP3","binaryURL":"opensuse153","display":"SLES 15 SP3","distribution":"sle","release":"15.3","build_distribution":"","sysReqs":true,"binaries":true,"hidden":true,"official_rspm":true,"arch":["x86_64"]},{"name":"sles154","os":"linux","binaryDisplay":"OpenSUSE 15.4, SLES 15 SP4","binaryURL":"opensuse154","display":"SLES 15 SP4","distribution":"sle","release":"15.4","build_distribution":"","sysReqs":true,"binaries":true,"hidden":true,"official_rspm":true,"arch":["x86_64"]},{"name":"sles155","os":"linux","binaryDisplay":"OpenSUSE 15.5, SLES 15 SP5","binaryURL":"opensuse155","display":"SLES 15 SP5","distribution":"sle","release":"15.5","build_distribution":"","sysReqs":true,"binaries":true,"hidden":true,"official_rspm":true,"arch":["x86_64"]},{"name":"sles156","os":"linux","binaryDisplay":"OpenSUSE 15.6, SLES 15 SP6/SP7","binaryURL":"opensuse156","display":"SLES 15 SP6/SP7","distribution":"sle","release":"15.6","build_distribution":"","sysReqs":true,"binaries":true,"hidden":false,"official_rspm":true,"arch":["x86_64"]},{"name":"xenial","os":"linux","binaryDisplay":"Ubuntu 16.04 (Xenial)","binaryURL":"xenial","display":"Ubuntu 16.04 (Xenial)","distribution":"ubuntu","release":"16.04","build_distribution":"","sysReqs":true,"binaries":true,"hidden":true,"official_rspm":true,"arch":["x86_64"]},{"name":"bionic","os":"linux","binaryDisplay":"Ubuntu 18.04 (Bionic)","binaryURL":"bionic","display":"Ubuntu 18.04 (Bionic)","distribution":"ubuntu","release":"18.04","build_distribution":"","sysReqs":true,"binaries":true,"hidden":true,"official_rspm":true,"arch":["x86_64"]},{"name":"focal","os":"linux","binaryDisplay":"Ubuntu 20.04 (Focal)","binaryURL":"focal","display":"Ubuntu 20.04 (Focal)","distribution":"ubuntu","release":"20.04","build_distribution":"","sysReqs":true,"binaries":true,"hidden":true,"official_rspm":true,"arch":["x86_64"]},{"name":"jammy","os":"linux","binaryDisplay":"Ubuntu 22.04 (Jammy)","binaryURL":"jammy","display":"Ubuntu 22.04 (Jammy)","distribution":"ubuntu","release":"22.04","build_distribution":"","sysReqs":true,"binaries":true,"hidden":false,"official_rspm":true,"arch":["x86_64"]},{"name":"noble","os":"linux","binaryDisplay":"Ubuntu 24.04 (Jammy)","binaryURL":"noble","display":"Ubuntu 24.04 (Noble)","distribution":"ubuntu","release":"24.04","build_distribution":"","sysReqs":true,"binaries":true,"hidden":false,"official_rspm":true,"arch":["x86_64","arm64"]},{"name":"buster","os":"linux","binaryDisplay":"Debian 10 (Buster)","binaryURL":"buster","display":"Debian 10 (Buster)","distribution":"debian","release":"10","build_distribution":"","sysReqs":true,"binaries":false,"hidden":true,"official_rspm":true,"arch":["x86_64"]},{"name":"bullseye","os":"linux","binaryDisplay":"Debian 11 (Bullseye)","binaryURL":"bullseye","display":"Debian 11 (Bullseye)","distribution":"debian","release":"11","build_distribution":"","sysReqs":true,"binaries":true,"hidden":true,"official_rspm":true,"arch":["x86_64"]},{"name":"bookworm","os":"linux","binaryDisplay":"Debian 12 (Bookworm)","binaryURL":"bookworm","display":"Debian 12 (Bookworm)","distribution":"debian","release":"12","build_distribution":"","sysReqs":true,"binaries":true,"hidden":false,"official_rspm":true,"arch":["x86_64"]},{"name":"trixie","os":"linux","binaryDisplay":"Debian 13 (Trixie)","binaryURL":"trixie","display":"Debian 13 (Trixie)","distribution":"debian","release":"13","build_distribution":"","sysReqs":true,"binaries":true,"hidden":false,"official_rspm":true,"arch":["x86_64"]},{"name":"windows","os":"windows","binaryDisplay":"","binaryURL":"","display":"Windows","distribution":"windows","release":"all","build_distribution":"","sysReqs":false,"binaries":true,"hidden":false,"official_rspm":true,"arch":["x86_64"]},{"name":"macos","os":"macos","binaryDisplay":"","binaryURL":"","display":"macOS","distribution":"macos","release":"all","build_distribution":"jammy","sysReqs":false,"binaries":true,"hidden":false,"official_rspm":true,"arch":["x86_64","arm64"]},{"name":"manylinux_2_28","os":"linux","binaryDisplay":"manylinux glibc 2.28+ (preview)","binaryURL":"manylinux_2_28","display":"manylinux glibc 2.28+ (preview)","distribution":"centos","release":"8","build_distribution":"","sysReqs":false,"binaries":true,"hidden":false,"official_rspm":true,"arch":["x86_64","arm64"]},{"name":"internal","os":"linux","binaryDisplay":"internal","binaryURL":"internal","display":"internal","distribution":"internal","release":"all","build_distribution":"","sysReqs":true,"binaries":true,"hidden":true,"official_rspm":true}],"cran_repo":"cran","bioc_versions":[{"bioc_version":"3.23","r_version":"4.6","cran_snapshot":"latest"},{"bioc_version":"3.22","r_version":"4.5","cran_snapshot":"latest"},{"bioc_version":"3.21","r_version":"4.5","cran_snapshot":"2025-10-30"},{"bioc_version":"3.20","r_version":"4.4","cran_snapshot":"2025-04-16"},{"bioc_version":"3.19","r_version":"4.4","cran_snapshot":"2024-10-30"},{"bioc_version":"3.18","r_version":"4.3","cran_snapshot":"2024-05-01"},{"bioc_version":"3.17","r_version":"4.3","cran_snapshot":"2023-10-25"},{"bioc_version":"3.16","r_version":"4.2","cran_snapshot":"2023-04-26"},{"bioc_version":"3.15","r_version":"4.2","cran_snapshot":"2022-11-02"},{"bioc_version":"3.14","r_version":"4.1","cran_snapshot":"2022-04-27"},{"bioc_version":"3.13","r_version":"4.1","cran_snapshot":"2021-10-27"},{"bioc_version":"3.12","r_version":"4.0","cran_snapshot":"2021-05-20"},{"bioc_version":"3.11","r_version":"4.0","cran_snapshot":"2020-10-28"},{"bioc_version":"3.10","r_version":"3.6","cran_snapshot":"2020-04-27"},{"bioc_version":"3.9","r_version":"3.6","cran_snapshot":"2019-10-28"},{"bioc_version":"3.8","r_version":"3.5","cran_snapshot":"2019-05-02"},{"bioc_version":"3.7","r_version":"3.5","cran_snapshot":"2018-10-29"},{"bioc_version":"3.6","r_version":"3.4","cran_snapshot":"2018-04-30"},{"bioc_version":"3.5","r_version":"3.4","cran_snapshot":"2017-10-30"},{"bioc_version":"3.4","r_version":"3.3","cran_snapshot":""},{"bioc_version":"3.3","r_version":"3.3","cran_snapshot":""},{"bioc_version":"3.2","r_version":"3.2","cran_snapshot":""},{"bioc_version":"3.1","r_version":"3.2","cran_snapshot":""}],"r_versions":["4.5","4.4","4.3","4.2","4.1","3.6"],"macos_urls":{"3.6":{"x86_64":"el-capitan"},"4.0":{"x86_64":""},"4.1":{"arm64":"big-sur-arm64","x86_64":""},"4.2":{"arm64":"big-sur-arm64","x86_64":""},"default":{"arm64":"big-sur-arm64","x86_64":"big-sur-x86_64"}},"support_window":{"disable_expiry_banner":false,"days_left":478,"days_reminder":90}}

tests/testthat/_snaps/ppm.md

# async_get_ppm_status 2

Code
      ret
    Output
                          name      os     binary_url distribution release binaries
      1                centos7   linux        centos7       centos       7     TRUE
      2                centos8   linux        centos8       centos       8     TRUE
      3                  rhel9   linux          rhel9   rockylinux       9     TRUE
      4                 rhel10   linux         rhel10   rockylinux      10     TRUE
      5             opensuse15   linux     opensuse15     opensuse      15     TRUE
      6            opensuse152   linux    opensuse152     opensuse    15.2     TRUE
      7            opensuse153   linux    opensuse153     opensuse    15.3     TRUE
      8            opensuse154   linux    opensuse154     opensuse    15.4     TRUE
      9            opensuse155   linux    opensuse155     opensuse    15.5     TRUE
      10           opensuse156   linux    opensuse156     opensuse    15.6     TRUE
      11            opensuse42   linux     opensuse42     opensuse    42.3     TRUE
      12                 rhel7   linux        centos7       redhat       7     TRUE
      13                 rhel8   linux        centos8       redhat       8     TRUE
      14  rhel9 (unused alias)   linux          rhel9       redhat       9     TRUE
      15 rhel10 (unused alias)   linux         rhel10       redhat      10     TRUE
      16                sles12   linux     opensuse42          sle    12.3     TRUE
      17                sles15   linux     opensuse15          sle      15     TRUE
      18               sles152   linux    opensuse152          sle    15.2     TRUE
      19               sles153   linux    opensuse153          sle    15.3     TRUE
      20               sles154   linux    opensuse154          sle    15.4     TRUE
      21               sles155   linux    opensuse155          sle    15.5     TRUE
      22               sles156   linux    opensuse156          sle    15.6     TRUE
      23                xenial   linux         xenial       ubuntu   16.04     TRUE
      24                bionic   linux         bionic       ubuntu   18.04     TRUE
      25                 focal   linux          focal       ubuntu   20.04     TRUE
      26                 jammy   linux          jammy       ubuntu   22.04     TRUE
      27                 noble   linux          noble       ubuntu   24.04     TRUE
      28                buster   linux         buster       debian      10    FALSE
      29              bullseye   linux       bullseye       debian      11     TRUE
      30              bookworm   linux       bookworm       debian      12     TRUE
      31                trixie   linux         trixie       debian      13     TRUE
      32               windows windows                     windows     all     TRUE
      33                 macos   macos                       macos     all     TRUE
      34        manylinux_2_28   linux manylinux_2_28       centos       8     TRUE
      35              internal   linux       internal     internal     all     TRUE
                                                                                                                platforms
      1                                                                                                          centos-7
      2                                                                                                          centos-8
      3         rockylinux-9, rhel-9, /rhel-9[.][0-9]+/, rocky-9, /rocky-9[.][0-9]+/, almalinux-9, /almalinux-9[.][0-9]+/
      4  rockylinux-10, rhel-10, /rhel-10[.][0-9]+/, rocky-10, /rocky-10[.][0-9]+/, almalinux-10, /almalinux-10[.][0-9]+/
      5               opensuse-15, opensuse-15.0, opensuse-15.1, opensuse-leap-15, opensuse-leap-15.0, opensuse-leap-15.1
      6                                                                                 opensuse-15.2, opensuse-leap-15.2
      7                                                                                 opensuse-15.3, opensuse-leap-15.3
      8                                                                                 opensuse-15.4, opensuse-leap-15.4
      9                                                                                 opensuse-15.5, opensuse-leap-15.5
      10                                                                                opensuse-15.6, opensuse-leap-15.6
      11                                                                                opensuse-42.3, opensuse-leap-42.3
      12                                                                              redhat-7, rhel-7, /rhel-7[.][0-9]+/
      13            redhat-8, rhel-8, /rhel-8[.][0-9]+/, rocky-8, /rocky-8[.][0-9]+/, almalinux-8, /almalinux-8[.][0-9]+/
      14                                                                                                         redhat-9
      15                                                                                                        redhat-10
      16                                                                                              sle-12.3, sles-12.3
      17                                                                             sle-15, sle-15.1, sles-15, sles-15.1
      18                                                                                              sle-15.2, sles-15.2
      19                                                                                              sle-15.3, sles-15.3
      20                                                                                              sle-15.4, sles-15.4
      21                                                                                              sle-15.5, sles-15.5
      22                                                                                              sle-15.6, sles-15.6
      23                                                                                                     ubuntu-16.04
      24                                                                                                     ubuntu-18.04
      25                                                                                                     ubuntu-20.04
      26                                                                                                     ubuntu-22.04
      27                                                                                                     ubuntu-24.04
      28                                                                                                        debian-10
      29                                                                                                        debian-11
      30                                                                                                        debian-12
      31                                                                                                        debian-13
      32                                                                                                      windows-all
      33                                                                                                        macos-all
      34                                                                                                         centos-8
      35                                                                                                     internal-all